{
  "description": "Theoretical and physical limits for computing technologies",
  "version": "2.0.0",
  "last_updated": "2024-10-29",

  "fundamental_physics_limits": {
    "description": "Hard limits imposed by the laws of physics",
    
    "speed_of_light": {
      "value": 299792458,
      "unit": "meters per second",
      "in_vacuum": true,
      "practical_implications": {
        "signal_delay_1cm": "0.033 nanoseconds",
        "signal_delay_1m": "3.3 nanoseconds",
        "signal_delay_1000km": "3.3 milliseconds",
        "notes": "Minimum latency between components. Limits CPU clock speeds and distributed computing."
      },
      "light_travel_per_ghz_cycle": {
        "at_1ghz": "30 cm",
        "at_3ghz": "10 cm",
        "at_5ghz": "6 cm",
        "notes": "At 5 GHz, light travels only 6cm per clock cycle. This fundamentally limits how large a synchronous chip can be."
      }
    },
    
    "heisenberg_uncertainty": {
      "principle": "ΔE·Δt ≥ ℏ/2",
      "implication": "Cannot measure energy precisely in arbitrarily short time",
      "practical_impact": "Limits minimum switching time and energy of transistors",
      "notes": "Quantum effects become dominant below ~5nm feature sizes"
    },
    
    "bekenstein_bound": {
      "description": "Maximum information density in a physical system",
      "formula": "I ≤ 2πRE/(ℏc·ln2)",
      "practical_value": "~1.4e69 bits per kg per meter",
      "notes": "Theoretical upper bound on storage density. Practical limits are many orders of magnitude lower.",
      "example": "1 liter sphere could theoretically store ~10^31 bits, but black hole would form"
    },
    
    "landauer_limit": {
      "value": 2.99e-21,
      "unit": "Joules per bit erasure",
      "temperature_k": 300,
      "formula": "kT·ln(2)",
      "description": "Thermodynamic minimum energy to erase one bit of information at room temperature",
      "practical_gap": "Current computing is ~1 million times above this limit",
      "notes": "Applies to irreversible computation. Reversible computation could theoretically avoid this limit."
    },
    
    "shot_noise_limit": {
      "description": "Quantum noise in electrical signals",
      "implication": "Limits minimum detectable signal in communications and sensors",
      "practical_impact": "Affects analog computing, sensors, and high-speed communications"
    }
  },

  "semiconductor_limits": {
    "description": "Physical limits for semiconductor technology",
    
    "process_node_limits": {
      "silicon_atomic_spacing": {
        "value": 0.543,
        "unit": "nm",
        "description": "Silicon lattice constant",
        "notes": "Fundamental physical size of silicon crystal structure"
      },
      "gate_oxide_limit": {
        "current_thickness": "0.5-1.0",
        "minimum_practical": "0.3",
        "unit": "nm",
        "limit_reason": "Below this, quantum tunneling causes excessive leakage current",
        "notes": "High-k dielectrics (HfO2) help reduce tunneling"
      },
      "practical_silicon_limit": {
        "value_range": "0.5-1.0",
        "unit": "nm",
        "description": "Practical lower bound for planar silicon transistors",
        "expected_timeframe": "2028-2032",
        "notes": "Quantum effects and variability dominate. GAA and nanosheets extend scaling."
      },
      "current_production_2024": {
        "value": 3,
        "unit": "nm (marketing name)",
        "actual_features": "24nm metal pitch, 48nm gate pitch",
        "manufacturers": ["TSMC N3", "Samsung 3nm GAA"],
        "transistor_density": "250-300 MTr/mm²",
        "notes": "Node names are marketing terms, not actual feature sizes"
      },
      "announced_2025_2026": {
        "value": 2,
        "unit": "nm (marketing name)",
        "manufacturers": ["TSMC N2", "Intel 18A"],
        "technology": "Gate-all-around (GAA) nanosheets",
        "notes": "Production beginning 2025-2026"
      }
    },
    
    "transistor_density_limits": {
      "current_best_2024": {
        "value": "250-300",
        "unit": "million transistors per mm²",
        "node": "3nm class",
        "examples": ["Apple M3/M4", "Qualcomm Snapdragon 8 Gen 3"]
      },
      "projected_2027": {
        "value": "400-500",
        "unit": "million transistors per mm²",
        "node": "2nm class",
        "technology": "GAA, improved density"
      },
      "projected_2030": {
        "value": "700-1000",
        "unit": "million transistors per mm²",
        "node": "1nm equivalent",
        "technology": "Advanced GAA, 3D stacking, new materials",
        "uncertainty": "High - depends on breakthrough technologies"
      },
      "theoretical_limit_2d": {
        "value": "~10000",
        "unit": "million transistors per mm²",
        "notes": "Approaching atomic scale. 3D stacking extends this further."
      }
    },
    
    "clock_frequency_limits": {
      "current_consumer_max_2024": {
        "value": "5700-6200",
        "unit": "MHz",
        "examples": ["Intel i9-14900KS", "AMD Ryzen 9 7950X3D"],
        "power_range": "200-300 watts",
        "cooling": "High-end air or liquid"
      },
      "practical_limit_air_cooling": {
        "value": "6000-6500",
        "unit": "MHz",
        "power_watts": "250-350",
        "limit_reason": "Power density and heat dissipation with consumer cooling"
      },
      "practical_limit_exotic_cooling": {
        "value": "7000-9000",
        "unit": "MHz",
        "cooling": "LN2, phase change",
        "notes": "Overclocking records, not practical for daily use"
      },
      "theoretical_silicon_limit": {
        "value": "10000-20000",
        "unit": "MHz",
        "limit_reason": "Electron mobility in silicon, RC delays, power density",
        "notes": "Would require revolutionary cooling and power delivery"
      },
      "alternative_materials": {
        "graphene": "Potential 1 THz (1,000,000 MHz), but no practical transistors yet",
        "carbon_nanotubes": "100+ GHz demonstrated in lab",
        "notes": "Manufacturing at scale remains unsolved"
      }
    },
    
    "interconnect_limits": {
      "rc_delay": {
        "description": "Resistance-capacitance delay in wires",
        "impact": "Becomes dominant at small feature sizes",
        "notes": "Limits clock frequency and requires sophisticated routing"
      },
      "electromigration": {
        "description": "Metal atoms migrate under current, causing wire failure",
        "impact": "Limits current density in wires",
        "typical_limit": "1-2 mA/μm² for copper",
        "notes": "Worse at higher temperatures, limits chip power density"
      },
      "crosstalk": {
        "description": "Signal interference between adjacent wires",
        "impact": "Requires spacing and shielding, reducing density",
        "notes": "Worse at smaller geometries and higher frequencies"
      }
    }
  },

  "moores_law": {
    "description": "Moore's Law historical trends and current status",
    
    "original_formulation_1965": {
      "doubling_period": 12,
      "unit": "months",
      "metric": "Component count at minimum cost per component",
      "year": 1965,
      "author": "Gordon Moore",
      "notes": "Original observation based on 1959-1965 data"
    },
    
    "revised_formulation_1975": {
      "doubling_period": 24,
      "unit": "months",
      "metric": "Transistor count",
      "year": 1975,
      "notes": "This became the commonly cited version, held approximately until ~2012"
    },
    
    "historical_periods": {
      "golden_age_1975_2005": {
        "doubling_period": 24,
        "unit": "months",
        "notes": "Dennard scaling: performance doubled with each generation"
      },
      "post_dennard_2005_2015": {
        "doubling_period": 24,
        "unit": "months",
        "notes": "Transistor density doubled, but clock speeds plateaued due to power"
      },
      "slowing_2015_2024": {
        "doubling_period": "30-36",
        "unit": "months",
        "notes": "Physical and economic barriers slowing progression"
      }
    },
    
    "current_trend_2024": {
      "transistor_doubling_period": "36-42",
      "unit": "months",
      "notes": "Slowing significantly due to physical limits and economics",
      "cost_per_transistor": "No longer decreasing for leading-edge nodes"
    },
    
    "projected_trajectory": {
      "2025_2030": {
        "doubling_period": "48+",
        "unit": "months",
        "notes": "Transition to 3D stacking and alternative scaling methods"
      },
      "post_2030": {
        "status": "End of traditional 2D scaling",
        "alternatives": [
          "3D chip stacking",
          "Chiplets and advanced packaging",
          "New materials (2D materials, III-V semiconductors)",
          "New transistor types (CFET, nanosheets)",
          "Beyond-CMOS: photonics, quantum, neuromorphic"
        ]
      }
    },
    
    "dennard_scaling": {
      "description": "Power density stays constant as transistors shrink",
      "period": "1974-2005",
      "end_reason": "Leakage current and voltage scaling limits",
      "impact": "End of 'free' performance gains, led to multi-core era",
      "notes": "This is what actually ended around 2005, not Moore's Law itself"
    }
  },

  "memory_limits": {
    "description": "Memory technology scaling limits",
    
    "dram_scaling": {
      "current_node_2024": "10-12",
      "near_term_limit": "8-10",
      "practical_limit": "6-8",
      "theoretical_limit": "5",
      "unit": "nm",
      "limit_reason": "Minimum capacitance for reliable charge storage",
      "alternatives": ["3D stacking (HBM)", "MRAM", "ReRAM", "PCM"],
      "notes": "DRAM scaling slower than logic due to capacitance requirements"
    },
    
    "sram_scaling": {
      "current_size": "0.020-0.030",
      "practical_limit": "0.010",
      "unit": "μm² per bit",
      "limit_reason": "6-transistor cell requires minimum area for stability",